{
  "$schema": "./schema.json",
  "schemaVersion": 1,
  "catalog": "cortex-training",
  "lastReviewed": "2026-09-02",
  "models": [
    {
      "name": "Qwen3 0.6B",
      "modelId": "Qwen/Qwen3-0.6B",
      "license": {
        "name": "Apache 2.0",
        "url": "https://huggingface.co/Qwen/Qwen3-0.6B/blob/main/LICENSE"
      },
      "capabilities": {
        "inference": {
          "supported": true,
          "maxContextTokens": 32768,
          "recommendedProfileId": "inference-8gpu"
        },
        "training": {
          "supported": true,
          "profiles": {
            "sftLora": {
              "maxContextTokens": 32768,
              "recommendedProfileId": "dense-sft-lora-8gpu"
            },
            "sftFull": {
              "maxContextTokens": 32768,
              "recommendedProfileId": "dense-sft-full-8gpu"
            },
            "rlLora": {
              "maxContextTokens": 32768,
              "recommendedProfileId": "dense-rl-lora-8x8"
            },
            "rlFull": {
              "maxContextTokens": 32768,
              "recommendedProfileId": "dense-rl-full-8x8"
            }
          }
        }
      }
    },
    {
      "name": "Qwen3 1.7B",
      "modelId": "Qwen/Qwen3-1.7B",
      "license": {
        "name": "Apache 2.0",
        "url": "https://huggingface.co/Qwen/Qwen3-1.7B/blob/main/LICENSE"
      },
      "capabilities": {
        "inference": {
          "supported": true,
          "maxContextTokens": 32768,
          "recommendedProfileId": "inference-8gpu"
        },
        "training": {
          "supported": true,
          "profiles": {
            "sftLora": {
              "maxContextTokens": 32768,
              "recommendedProfileId": "dense-sft-lora-8gpu"
            },
            "sftFull": {
              "maxContextTokens": 32768,
              "recommendedProfileId": "dense-sft-full-8gpu"
            },
            "rlLora": {
              "maxContextTokens": 32768,
              "recommendedProfileId": "dense-rl-lora-8x8"
            },
            "rlFull": {
              "maxContextTokens": 32768,
              "recommendedProfileId": "dense-rl-full-8x8"
            }
          }
        }
      }
    },
    {
      "name": "Qwen3 8B",
      "modelId": "Qwen/Qwen3-8B",
      "license": {
        "name": "Apache 2.0",
        "url": "https://huggingface.co/Qwen/Qwen3-8B/blob/main/LICENSE"
      },
      "capabilities": {
        "inference": {
          "supported": true,
          "maxContextTokens": 32768,
          "recommendedProfileId": "inference-8gpu"
        },
        "training": {
          "supported": true,
          "profiles": {
            "sftLora": {
              "maxContextTokens": 32768,
              "recommendedProfileId": "dense-sft-lora-8gpu"
            },
            "sftFull": {
              "maxContextTokens": 32768,
              "recommendedProfileId": "dense-sft-full-8gpu"
            },
            "rlLora": {
              "maxContextTokens": 32768,
              "recommendedProfileId": "dense-rl-lora-8x8"
            },
            "rlFull": {
              "maxContextTokens": 32768,
              "recommendedProfileId": "dense-rl-full-8x8"
            }
          }
        }
      }
    },
    {
      "name": "Qwen3.5 4B",
      "modelId": "Qwen/Qwen3.5-4B",
      "license": {
        "name": "Apache 2.0",
        "url": "https://huggingface.co/Qwen/Qwen3.5-4B/blob/main/LICENSE"
      },
      "capabilities": {
        "inference": {
          "supported": true,
          "maxContextTokens": 262144,
          "recommendedProfileId": "inference-8gpu"
        },
        "training": {
          "supported": true,
          "profiles": {
            "sftLora": {
              "maxContextTokens": 32768,
              "recommendedProfileId": "dense-sft-lora-8gpu",
              "lastValidated": "2026-09-02",
              "longSequence": {
                "maxContextTokens": 262144,
                "recommendedProfileId": "dense-long-sft-lora-8gpu"
              }
            },
            "sftFull": {
              "maxContextTokens": 32768,
              "recommendedProfileId": "dense-sft-full-8gpu",
              "lastValidated": "2026-09-02",
              "longSequence": {
                "maxContextTokens": 262144,
                "recommendedProfileId": "dense-long-sft-full-8gpu"
              }
            },
            "rlLora": {
              "maxContextTokens": 32768,
              "recommendedProfileId": "dense-rl-lora-8x8",
              "lastValidated": "2026-09-02",
              "longSequence": {
                "maxContextTokens": 262144,
                "recommendedProfileId": "dense-long-rl-lora-8x8"
              }
            },
            "rlFull": {
              "maxContextTokens": 32768,
              "recommendedProfileId": "dense-rl-full-8x8",
              "lastValidated": "2026-09-02",
              "longSequence": {
                "maxContextTokens": 262144,
                "recommendedProfileId": "dense-long-rl-full-8x8"
              }
            }
          }
        }
      }
    },
    {
      "name": "Qwen3.6 35B-A3B",
      "modelId": "Qwen/Qwen3.6-35B-A3B",
      "license": {
        "name": "Apache 2.0",
        "url": "https://huggingface.co/Qwen/Qwen3.6-35B-A3B/blob/main/LICENSE"
      },
      "capabilities": {
        "inference": {
          "supported": true,
          "maxContextTokens": 262144,
          "recommendedProfileId": "inference-8gpu"
        },
        "training": {
          "supported": true,
          "profiles": {
            "sftLora": {
              "maxContextTokens": 32768,
              "recommendedProfileId": "moe-sft-lora-8gpu",
              "lastValidated": "2026-09-02",
              "longSequence": {
                "maxContextTokens": 262144,
                "recommendedProfileId": "moe-long-sft-lora-8gpu"
              }
            },
            "sftFull": {
              "maxContextTokens": 32768,
              "recommendedProfileId": "moe-sft-full-8gpu",
              "lastValidated": "2026-09-02",
              "longSequence": {
                "maxContextTokens": 262144,
                "recommendedProfileId": "moe-long-sft-full-8gpu"
              }
            },
            "rlLora": {
              "maxContextTokens": 32768,
              "recommendedProfileId": "moe-rl-lora-8x8",
              "lastValidated": "2026-09-02",
              "longSequence": {
                "maxContextTokens": 262144,
                "recommendedProfileId": "moe-long-rl-lora-8x8"
              }
            },
            "rlFull": {
              "maxContextTokens": 32768,
              "recommendedProfileId": "moe-rl-full-8x8",
              "lastValidated": "2026-09-02",
              "longSequence": {
                "maxContextTokens": 262144,
                "recommendedProfileId": "moe-long-rl-full-16x16"
              }
            }
          }
        }
      }
    },
    {
      "name": "Qwen3.8 27B",
      "modelId": "Qwen/Qwen3.8-27B",
      "license": {
        "name": "Apache 2.0",
        "url": "https://huggingface.co/Qwen/Qwen3.8-27B/blob/main/LICENSE"
      },
      "capabilities": {
        "inference": {
          "supported": true,
          "maxContextTokens": 262144,
          "recommendedProfileId": "inference-8gpu"
        },
        "training": {
          "supported": true,
          "profiles": {
            "sftLora": {
              "maxContextTokens": 32768,
              "recommendedProfileId": "dense-sft-lora-8gpu",
              "lastValidated": "2026-09-02",
              "longSequence": {
                "maxContextTokens": 262144,
                "recommendedProfileId": "dense-long-sft-lora-8gpu",
                "lastValidated": "2026-09-02"
              }
            },
            "sftFull": {
              "maxContextTokens": 32768,
              "recommendedProfileId": "dense-sft-full-8gpu",
              "lastValidated": "2026-09-02",
              "longSequence": {
                "maxContextTokens": 262144,
                "recommendedProfileId": "dense-long-sft-full-8gpu",
                "lastValidated": "2026-09-02"
              }
            },
            "rlLora": {
              "maxContextTokens": 32768,
              "recommendedProfileId": "dense-rl-lora-eager-8x8",
              "lastValidated": "2026-09-02",
              "longSequence": {
                "maxContextTokens": 262144,
                "recommendedProfileId": "dense-long-rl-lora-eager-8x8"
              }
            },
            "rlFull": {
              "maxContextTokens": 32768,
              "recommendedProfileId": "dense-rl-full-8x8",
              "lastValidated": "2026-09-02",
              "longSequence": {
                "maxContextTokens": 262144,
                "recommendedProfileId": "dense-long-rl-full-8x8"
              }
            }
          }
        }
      }
    },
    {
      "name": "DeepSeek V4 Flash",
      "modelId": "deepseek-ai/DeepSeek-V4-Flash-0731",
      "license": {
        "name": "MIT",
        "url": "https://huggingface.co/deepseek-ai/DeepSeek-V4-Flash/blob/main/LICENSE"
      },
      "capabilities": {
        "inference": {
          "supported": true,
          "maxContextTokens": 1048576,
          "recommendedProfileId": "inference-8gpu-tp8-fp8-kv",
          "lastValidated": "2026-09-01"
        },
        "training": {
          "supported": false
        }
      }
    },
    {
      "name": "GPT-OSS 120B",
      "modelId": "openai/gpt-oss-120b",
      "license": {
        "name": "Apache 2.0",
        "url": "https://huggingface.co/openai/gpt-oss-120b/blob/main/LICENSE"
      },
      "capabilities": {
        "inference": {
          "supported": true,
          "maxContextTokens": 131072,
          "recommendedProfileId": "inference-8gpu-tp8-fp8-kv"
        },
        "training": {
          "supported": false
        }
      }
    },
    {